{
  "case_id": "initialize-anchor-lineage-map-mismatch",
  "case_version": "m2.1-conformance-case/v1",
  "entrypoint": "initialize-anchor",
  "expected": {
    "authorizing": false,
    "code": "input.schema_invalid",
    "decision_status": "not-reached",
    "expected_anchor": null,
    "reached_stage": 2,
    "status": "rejected"
  },
  "input_base64url": "eyJpbml0aWFsX2F1dGhvcml6YXRpb25fY29udGV4dCI6eyJlbnZlbG9wZV92ZXJzaW9uIjoidmFyaWF4aW9tLWVudmVsb3BlL3YxIiwia2luZCI6ImF1dGhvcml6YXRpb24tY29udGV4dCIsInBheWxvYWQiOnsiYXV0aG9yaXphdGlvbl9jb250ZXh0X3ZlcnNpb24iOiJhdXRob3JpemF0aW9uLWNvbnRleHQvdjEiLCJjYXBhYmlsaXR5X25hbWVzcGFjZSI6InZhcmlheGlvbS1jYXBhYmlsaXR5L3YxIiwiY29uc3RpdHV0aW9uX2FydGlmYWN0X2hhc2giOiIyMzhhOTM2MTUyNWY4Y2U0N2E0MjViOTNjNmE0OWZmNWZhNjZmOGJjMGE3MGM3YWVkMDI2N2YxMWE5MDQ0YzljIiwiY29uc3RpdHV0aW9uX2VudmVsb3BlX2RpZ2VzdCI6IjZiNzc5NjRiM2JhZmUyNGMyNmM1ZTk5ZDA5M2FiZGJkYTUxZGUzNjA1Nzg3Zjk0MjA0YWQ5ZTJjYjAyYzM1NTUiLCJrbm93bl9saW5lYWdlX2lkcyI6W10sImxpbmVhZ2VfY2FwYWJpbGl0aWVzIjp7Imdlbm9tZTpwYXJlbnQiOltdfSwibGluZWFnZV9pZCI6ImxpbmVhZ2U6ZXhhbXBsZSIsInRydXN0X2RvbWFpbl9pZCI6InRydXN0LWRvbWFpbjpleGFtcGxlIiwidmVyaWZpZWRfYXJ0aWZhY3RfaGFzaGVzIjpbImJiYmJiYmJiYmJiYmJiYmJiYmJiYmJiYmJiYmJiYmJiYmJiYmJiYmJiYmJiYmJiYmJiYmJiYmJiYmJiYmJiYmIiXX19LCJpbml0aWFsX2lkZW50aXR5X2NvbnRleHQiOnsiZW52ZWxvcGVfdmVyc2lvbiI6InZhcmlheGlvbS1lbnZlbG9wZS92MSIsImtpbmQiOiJpZGVudGl0eS1jb250ZXh0IiwicGF5bG9hZCI6eyJldmFsdWF0aW9uX3RpbWVfdW5peF9zIjoxNzg4NzM5MjAwLCJpZGVudGl0eV9jb250ZXh0X3ZlcnNpb24iOiJpZGVudGl0eS1jb250ZXh0L3YxIiwicHJldmlvdXNfc25hcHNob3RfZGlnZXN0IjpudWxsLCJwcmluY2lwYWxzIjpbeyJrZXlzIjpbeyJhbGdvcml0aG0iOiJFZDI1NTE5Iiwia2V5X2JpbmRpbmdfdmVyc2lvbiI6ImtleS1iaW5kaW5nL3YxIiwia2V5X2lkIjoia2V5OnNoYTI1Njo5MWUxZDU4NzQ3NDkyOGI1NjZjMTNlODU0NmM5NzdhYTEzOTI3YzQwYzM3MjE4NWQ1NjVkZGZmNTEyNTFkNjA5IiwicHVibGljX2tleV9iYXNlNjR1cmwiOiIxMXFZQVlLeENyZlZTXzdUeVdRSE9nN2hjdlBhcGlNbHJ3SWFhUGNIVVJvIn1dLCJwcmluY2lwYWxfaWQiOiJwcmluY2lwYWw6YnVpbGRlciIsInByaW5jaXBhbF92ZXJzaW9uIjoicHJpbmNpcGFsL3YxIiwicm9sZXMiOlsiY2FuZGlkYXRlLXByb3Bvc2VyIl19LHsia2V5cyI6W3siYWxnb3JpdGhtIjoiRWQyNTUxOSIsImtleV9iaW5kaW5nX3ZlcnNpb24iOiJrZXktYmluZGluZy92MSIsImtleV9pZCI6ImtleTpzaGEyNTY6ZjA3ZmQ2YzZjNGM4MzZlZGE1YmIwYTRlZTJkZjBjZmM0NTI0YWFkMDA0YmM4OWJiOWVlMmFlNDc1NzQ3NzIyZSIsInB1YmxpY19rZXlfYmFzZTY0dXJsIjoiUFVBWHctaERpVnFTdHdxblRSdC12SnlZTE04dXhKYU13TTFWOFNyMFpndyJ9XSwicHJpbmNpcGFsX2lkIjoicHJpbmNpcGFsOmlzc3VlciIsInByaW5jaXBhbF92ZXJzaW9uIjoicHJpbmNpcGFsL3YxIiwicm9sZXMiOlsiYXV0aG9yaXR5LWlzc3VlciJdfSx7ImtleXMiOlt7ImFsZ29yaXRobSI6IkVkMjU1MTkiLCJrZXlfYmluZGluZ192ZXJzaW9uIjoia2V5LWJpbmRpbmcvdjEiLCJrZXlfaWQiOiJrZXk6c2hhMjU2OjAwNWE1MmZlMmViNmY5MjEyYTg5YTZkYTUzOTlmODU0N2U0NTMyZDQ0MmEyMjEyMWY5ZDFhMzkyMjg2MjNmNWEiLCJwdWJsaWNfa2V5X2Jhc2U2NHVybCI6Il9GSE5qbUlZb2FPTnBIN1FBakR3V0FnVzdSTzZNd09zWGV1UkZVaVFnQ1UifV0sInByaW5jaXBhbF9pZCI6InByaW5jaXBhbDpzZWxlY3RvciIsInByaW5jaXBhbF92ZXJzaW9uIjoicHJpbmNpcGFsL3YxIiwicm9sZXMiOlsicHJvbW90aW9uLXNlbGVjdG9yIl19LHsia2V5cyI6W3siYWxnb3JpdGhtIjoiRWQyNTUxOSIsImtleV9iaW5kaW5nX3ZlcnNpb24iOiJrZXktYmluZGluZy92MSIsImtleV9pZCI6ImtleTpzaGEyNTY6NzQwZTQ2MGY0NDc4OGFhZTY1NjE5ZDlhYTgwN2M4Y2U3ZTUzNjcwMWU4NWQ0MjljNDIyNjc2MjY5OGVlYjkyZSIsInB1YmxpY19rZXlfYmFzZTY0dXJsIjoiSjRFWF9CUk1jalFQWjlEeU1XNkRoczdfdnlza0tNbkZILTk4V1g4ZFFtNCJ9XSwicHJpbmNpcGFsX2lkIjoicHJpbmNpcGFsOnZlcmlmaWVyIiwicHJpbmNpcGFsX3ZlcnNpb24iOiJwcmluY2lwYWwvdjEiLCJyb2xlcyI6WyJldmlkZW5jZS12ZXJpZmllciJdfV0sInJldm9rZWRfZ3JhbnRfaWRzIjpbXSwicmV2b2tlZF9rZXlfaWRzIjpbXSwic25hcHNob3Rfc2VxdWVuY2UiOjAsInRydXN0X2RvbWFpbl9pZCI6InRydXN0LWRvbWFpbjpleGFtcGxlIn19LCJ0cnVzdGVkX25vd191bml4X3MiOjE3ODg3MzkyMDB9",
  "input_sha256": "7d656a2b49e88c03f82313ab9c6744d61baf4090e6f975a154004b45513ee82a",
  "notes": "Self-contained trusted-anchor genesis input.",
  "signature_vectors": [],
  "stage": 2
}
