{
  "case_id": "initialize-anchor-unsorted-roles",
  "case_version": "m2.1-conformance-case/v1",
  "entrypoint": "initialize-anchor",
  "expected": {
    "authorizing": false,
    "code": "input.schema_invalid",
    "decision_status": "not-reached",
    "expected_anchor": null,
    "reached_stage": 2,
    "status": "rejected"
  },
  "input_base64url": "eyJpbml0aWFsX2F1dGhvcml6YXRpb25fY29udGV4dCI6eyJlbnZlbG9wZV92ZXJzaW9uIjoidmFyaWF4aW9tLWVudmVsb3BlL3YxIiwia2luZCI6ImF1dGhvcml6YXRpb24tY29udGV4dCIsInBheWxvYWQiOnsiYXV0aG9yaXphdGlvbl9jb250ZXh0X3ZlcnNpb24iOiJhdXRob3JpemF0aW9uLWNvbnRleHQvdjEiLCJjYXBhYmlsaXR5X25hbWVzcGFjZSI6InZhcmlheGlvbS1jYXBhYmlsaXR5L3YxIiwiY29uc3RpdHV0aW9uX2FydGlmYWN0X2hhc2giOiIyMzhhOTM2MTUyNWY4Y2U0N2E0MjViOTNjNmE0OWZmNWZhNjZmOGJjMGE3MGM3YWVkMDI2N2YxMWE5MDQ0YzljIiwiY29uc3RpdHV0aW9uX2VudmVsb3BlX2RpZ2VzdCI6IjZiNzc5NjRiM2JhZmUyNGMyNmM1ZTk5ZDA5M2FiZGJkYTUxZGUzNjA1Nzg3Zjk0MjA0YWQ5ZTJjYjAyYzM1NTUiLCJrbm93bl9saW5lYWdlX2lkcyI6WyJnZW5vbWU6cGFyZW50Il0sImxpbmVhZ2VfY2FwYWJpbGl0aWVzIjp7Imdlbm9tZTpwYXJlbnQiOltdfSwibGluZWFnZV9pZCI6ImxpbmVhZ2U6ZXhhbXBsZSIsInRydXN0X2RvbWFpbl9pZCI6InRydXN0LWRvbWFpbjpleGFtcGxlIiwidmVyaWZpZWRfYXJ0aWZhY3RfaGFzaGVzIjpbImJiYmJiYmJiYmJiYmJiYmJiYmJiYmJiYmJiYmJiYmJiYmJiYmJiYmJiYmJiYmJiYmJiYmJiYmJiYmJiYmJiYmIiXX19LCJpbml0aWFsX2lkZW50aXR5X2NvbnRleHQiOnsiZW52ZWxvcGVfdmVyc2lvbiI6InZhcmlheGlvbS1lbnZlbG9wZS92MSIsImtpbmQiOiJpZGVudGl0eS1jb250ZXh0IiwicGF5bG9hZCI6eyJldmFsdWF0aW9uX3RpbWVfdW5peF9zIjoxNzg4NzM5MjAwLCJpZGVudGl0eV9jb250ZXh0X3ZlcnNpb24iOiJpZGVudGl0eS1jb250ZXh0L3YxIiwicHJldmlvdXNfc25hcHNob3RfZGlnZXN0IjpudWxsLCJwcmluY2lwYWxzIjpbeyJrZXlzIjpbeyJhbGdvcml0aG0iOiJFZDI1NTE5Iiwia2V5X2JpbmRpbmdfdmVyc2lvbiI6ImtleS1iaW5kaW5nL3YxIiwia2V5X2lkIjoia2V5OnNoYTI1Njo5MWUxZDU4NzQ3NDkyOGI1NjZjMTNlODU0NmM5NzdhYTEzOTI3YzQwYzM3MjE4NWQ1NjVkZGZmNTEyNTFkNjA5IiwicHVibGljX2tleV9iYXNlNjR1cmwiOiIxMXFZQVlLeENyZlZTXzdUeVdRSE9nN2hjdlBhcGlNbHJ3SWFhUGNIVVJvIn1dLCJwcmluY2lwYWxfaWQiOiJwcmluY2lwYWw6YnVpbGRlciIsInByaW5jaXBhbF92ZXJzaW9uIjoicHJpbmNpcGFsL3YxIiwicm9sZXMiOlsiei1yZXNlcnZlZCIsImNhbmRpZGF0ZS1wcm9wb3NlciJdfSx7ImtleXMiOlt7ImFsZ29yaXRobSI6IkVkMjU1MTkiLCJrZXlfYmluZGluZ192ZXJzaW9uIjoia2V5LWJpbmRpbmcvdjEiLCJrZXlfaWQiOiJrZXk6c2hhMjU2OmYwN2ZkNmM2YzRjODM2ZWRhNWJiMGE0ZWUyZGYwY2ZjNDUyNGFhZDAwNGJjODliYjllZTJhZTQ3NTc0NzcyMmUiLCJwdWJsaWNfa2V5X2Jhc2U2NHVybCI6IlBVQVh3LWhEaVZxU3R3cW5UUnQtdkp5WUxNOHV4SmFNd00xVjhTcjBaZ3cifV0sInByaW5jaXBhbF9pZCI6InByaW5jaXBhbDppc3N1ZXIiLCJwcmluY2lwYWxfdmVyc2lvbiI6InByaW5jaXBhbC92MSIsInJvbGVzIjpbImF1dGhvcml0eS1pc3N1ZXIiXX0seyJrZXlzIjpbeyJhbGdvcml0aG0iOiJFZDI1NTE5Iiwia2V5X2JpbmRpbmdfdmVyc2lvbiI6ImtleS1iaW5kaW5nL3YxIiwia2V5X2lkIjoia2V5OnNoYTI1NjowMDVhNTJmZTJlYjZmOTIxMmE4OWE2ZGE1Mzk5Zjg1NDdlNDUzMmQ0NDJhMjIxMjFmOWQxYTM5MjI4NjIzZjVhIiwicHVibGljX2tleV9iYXNlNjR1cmwiOiJfRkhOam1JWW9hT05wSDdRQWpEd1dBZ1c3Uk82TXdPc1hldVJGVWlRZ0NVIn1dLCJwcmluY2lwYWxfaWQiOiJwcmluY2lwYWw6c2VsZWN0b3IiLCJwcmluY2lwYWxfdmVyc2lvbiI6InByaW5jaXBhbC92MSIsInJvbGVzIjpbInByb21vdGlvbi1zZWxlY3RvciJdfSx7ImtleXMiOlt7ImFsZ29yaXRobSI6IkVkMjU1MTkiLCJrZXlfYmluZGluZ192ZXJzaW9uIjoia2V5LWJpbmRpbmcvdjEiLCJrZXlfaWQiOiJrZXk6c2hhMjU2Ojc0MGU0NjBmNDQ3ODhhYWU2NTYxOWQ5YWE4MDdjOGNlN2U1MzY3MDFlODVkNDI5YzQyMjY3NjI2OThlZWI5MmUiLCJwdWJsaWNfa2V5X2Jhc2U2NHVybCI6Iko0RVhfQlJNY2pRUFo5RHlNVzZEaHM3X3Z5c2tLTW5GSC05OFdYOGRRbTQifV0sInByaW5jaXBhbF9pZCI6InByaW5jaXBhbDp2ZXJpZmllciIsInByaW5jaXBhbF92ZXJzaW9uIjoicHJpbmNpcGFsL3YxIiwicm9sZXMiOlsiZXZpZGVuY2UtdmVyaWZpZXIiXX1dLCJyZXZva2VkX2dyYW50X2lkcyI6W10sInJldm9rZWRfa2V5X2lkcyI6W10sInNuYXBzaG90X3NlcXVlbmNlIjowLCJ0cnVzdF9kb21haW5faWQiOiJ0cnVzdC1kb21haW46ZXhhbXBsZSJ9fSwidHJ1c3RlZF9ub3dfdW5peF9zIjoxNzg4NzM5MjAwfQ",
  "input_sha256": "6c640368ea7f5120811191efc6551aabbd185929164d80170f9dae719debbed0",
  "notes": "Self-contained trusted-anchor genesis input.",
  "signature_vectors": [],
  "stage": 2
}
