{
  "case_id": "initialize-anchor-token-limit-plus-one",
  "case_version": "m2.1-conformance-case/v1",
  "entrypoint": "initialize-anchor",
  "expected": {
    "authorizing": false,
    "code": "input.limit_exceeded",
    "decision_status": "not-reached",
    "expected_anchor": null,
    "reached_stage": 2,
    "status": "rejected"
  },
  "input_base64url": "eyJpbml0aWFsX2F1dGhvcml6YXRpb25fY29udGV4dCI6eyJlbnZlbG9wZV92ZXJzaW9uIjoidmFyaWF4aW9tLWVudmVsb3BlL3YxIiwia2luZCI6ImF1dGhvcml6YXRpb24tY29udGV4dCIsInBheWxvYWQiOnsiYXV0aG9yaXphdGlvbl9jb250ZXh0X3ZlcnNpb24iOiJhdXRob3JpemF0aW9uLWNvbnRleHQvdjEiLCJjYXBhYmlsaXR5X25hbWVzcGFjZSI6InZhcmlheGlvbS1jYXBhYmlsaXR5L3YxIiwiY29uc3RpdHV0aW9uX2FydGlmYWN0X2hhc2giOiIyMzhhOTM2MTUyNWY4Y2U0N2E0MjViOTNjNmE0OWZmNWZhNjZmOGJjMGE3MGM3YWVkMDI2N2YxMWE5MDQ0YzljIiwiY29uc3RpdHV0aW9uX2VudmVsb3BlX2RpZ2VzdCI6IjZiNzc5NjRiM2JhZmUyNGMyNmM1ZTk5ZDA5M2FiZGJkYTUxZGUzNjA1Nzg3Zjk0MjA0YWQ5ZTJjYjAyYzM1NTUiLCJrbm93bl9saW5lYWdlX2lkcyI6WyJnZW5vbWU6cGFyZW50Il0sImxpbmVhZ2VfY2FwYWJpbGl0aWVzIjp7Imdlbm9tZTpwYXJlbnQiOltdfSwibGluZWFnZV9pZCI6Inh4eHh4eHh4eHh4eHh4eHh4eHh4eHh4eHh4eHh4eHh4eHh4eHh4eHh4eHh4eHh4eHh4eHh4eHh4eHh4eHh4eHh4eHh4eHh4eHh4eHh4eHh4eHh4eHh4eHh4eHh4eHh4eHh4eHh4eHh4eHh4eHh4eHh4eHh4eHh4eHh4eHh4eHh4eHh4eHh4eHh4eHh4eHh4eHh4eHh4eHh4eHh4eHh4eHh4eHh4eHh4eHh4eHh4eHh4eHh4eHh4eHh4eHh4eHh4eHh4eHh4eHh4eHh4eHh4eHh4eHh4eHh4eHh4eHh4eHh4eHh4eHh4eHh4eHh4eHh4eHh4eHh4eHh4eHh4eHh4eHh4IiwidHJ1c3RfZG9tYWluX2lkIjoidHJ1c3QtZG9tYWluOmV4YW1wbGUiLCJ2ZXJpZmllZF9hcnRpZmFjdF9oYXNoZXMiOlsiYmJiYmJiYmJiYmJiYmJiYmJiYmJiYmJiYmJiYmJiYmJiYmJiYmJiYmJiYmJiYmJiYmJiYmJiYmJiYmJiYmJiYiJdfX0sImluaXRpYWxfaWRlbnRpdHlfY29udGV4dCI6eyJlbnZlbG9wZV92ZXJzaW9uIjoidmFyaWF4aW9tLWVudmVsb3BlL3YxIiwia2luZCI6ImlkZW50aXR5LWNvbnRleHQiLCJwYXlsb2FkIjp7ImV2YWx1YXRpb25fdGltZV91bml4X3MiOjE3ODg3MzkyMDAsImlkZW50aXR5X2NvbnRleHRfdmVyc2lvbiI6ImlkZW50aXR5LWNvbnRleHQvdjEiLCJwcmV2aW91c19zbmFwc2hvdF9kaWdlc3QiOm51bGwsInByaW5jaXBhbHMiOlt7ImtleXMiOlt7ImFsZ29yaXRobSI6IkVkMjU1MTkiLCJrZXlfYmluZGluZ192ZXJzaW9uIjoia2V5LWJpbmRpbmcvdjEiLCJrZXlfaWQiOiJrZXk6c2hhMjU2OjkxZTFkNTg3NDc0OTI4YjU2NmMxM2U4NTQ2Yzk3N2FhMTM5MjdjNDBjMzcyMTg1ZDU2NWRkZmY1MTI1MWQ2MDkiLCJwdWJsaWNfa2V5X2Jhc2U2NHVybCI6IjExcVlBWUt4Q3JmVlNfN1R5V1FIT2c3aGN2UGFwaU1scndJYWFQY0hVUm8ifV0sInByaW5jaXBhbF9pZCI6InByaW5jaXBhbDpidWlsZGVyIiwicHJpbmNpcGFsX3ZlcnNpb24iOiJwcmluY2lwYWwvdjEiLCJyb2xlcyI6WyJjYW5kaWRhdGUtcHJvcG9zZXIiXX0seyJrZXlzIjpbeyJhbGdvcml0aG0iOiJFZDI1NTE5Iiwia2V5X2JpbmRpbmdfdmVyc2lvbiI6ImtleS1iaW5kaW5nL3YxIiwia2V5X2lkIjoia2V5OnNoYTI1NjpmMDdmZDZjNmM0YzgzNmVkYTViYjBhNGVlMmRmMGNmYzQ1MjRhYWQwMDRiYzg5YmI5ZWUyYWU0NzU3NDc3MjJlIiwicHVibGljX2tleV9iYXNlNjR1cmwiOiJQVUFYdy1oRGlWcVN0d3FuVFJ0LXZKeVlMTTh1eEphTXdNMVY4U3IwWmd3In1dLCJwcmluY2lwYWxfaWQiOiJwcmluY2lwYWw6aXNzdWVyIiwicHJpbmNpcGFsX3ZlcnNpb24iOiJwcmluY2lwYWwvdjEiLCJyb2xlcyI6WyJhdXRob3JpdHktaXNzdWVyIl19LHsia2V5cyI6W3siYWxnb3JpdGhtIjoiRWQyNTUxOSIsImtleV9iaW5kaW5nX3ZlcnNpb24iOiJrZXktYmluZGluZy92MSIsImtleV9pZCI6ImtleTpzaGEyNTY6MDA1YTUyZmUyZWI2ZjkyMTJhODlhNmRhNTM5OWY4NTQ3ZTQ1MzJkNDQyYTIyMTIxZjlkMWEzOTIyODYyM2Y1YSIsInB1YmxpY19rZXlfYmFzZTY0dXJsIjoiX0ZITmptSVlvYU9OcEg3UUFqRHdXQWdXN1JPNk13T3NYZXVSRlVpUWdDVSJ9XSwicHJpbmNpcGFsX2lkIjoicHJpbmNpcGFsOnNlbGVjdG9yIiwicHJpbmNpcGFsX3ZlcnNpb24iOiJwcmluY2lwYWwvdjEiLCJyb2xlcyI6WyJwcm9tb3Rpb24tc2VsZWN0b3IiXX0seyJrZXlzIjpbeyJhbGdvcml0aG0iOiJFZDI1NTE5Iiwia2V5X2JpbmRpbmdfdmVyc2lvbiI6ImtleS1iaW5kaW5nL3YxIiwia2V5X2lkIjoia2V5OnNoYTI1Njo3NDBlNDYwZjQ0Nzg4YWFlNjU2MTlkOWFhODA3YzhjZTdlNTM2NzAxZTg1ZDQyOWM0MjI2NzYyNjk4ZWViOTJlIiwicHVibGljX2tleV9iYXNlNjR1cmwiOiJKNEVYX0JSTWNqUVBaOUR5TVc2RGhzN192eXNrS01uRkgtOThXWDhkUW00In1dLCJwcmluY2lwYWxfaWQiOiJwcmluY2lwYWw6dmVyaWZpZXIiLCJwcmluY2lwYWxfdmVyc2lvbiI6InByaW5jaXBhbC92MSIsInJvbGVzIjpbImV2aWRlbmNlLXZlcmlmaWVyIl19XSwicmV2b2tlZF9ncmFudF9pZHMiOltdLCJyZXZva2VkX2tleV9pZHMiOltdLCJzbmFwc2hvdF9zZXF1ZW5jZSI6MCwidHJ1c3RfZG9tYWluX2lkIjoidHJ1c3QtZG9tYWluOmV4YW1wbGUifX0sInRydXN0ZWRfbm93X3VuaXhfcyI6MTc4ODczOTIwMH0",
  "input_sha256": "25f85593da60de8700288deed9e848771ef204ff1967e025cf37eceb028a6047",
  "notes": "Self-contained trusted-anchor genesis input.",
  "signature_vectors": [],
  "stage": 2
}
