{
  "case_id": "initialize-anchor-genesis",
  "case_version": "m2.1-conformance-case/v1",
  "entrypoint": "initialize-anchor",
  "expected": {
    "authorizing": false,
    "code": null,
    "decision_status": "not-reached",
    "expected_anchor": {
      "current_authorization_context_digest": "ee2beb3f71f0a1610321389a33f34223eddc215d3ea344ddca95099f9c31d5fc",
      "current_identity_context_digest": "cb7e07e67a19387a261532f436f9d153632736d69577edd646bd1c10444332db",
      "current_snapshot_sequence": 0,
      "key_ownership_registry": {
        "key:sha256:005a52fe2eb6f9212a89a6da5399f8547e4532d442a22121f9d1a39228623f5a": "principal:selector",
        "key:sha256:740e460f44788aae65619d9aa807c8ce7e536701e85d429c4226762698eeb92e": "principal:verifier",
        "key:sha256:91e1d587474928b566c13e8546c977aa13927c40c372185d565ddff51251d609": "principal:builder",
        "key:sha256:f07fd6c6c4c836eda5bb0a4ee2df0cfc4524aad004bc89bb9ee2ae475747722e": "principal:issuer"
      },
      "revoked_grant_ids": [
        "grant:sha256:eeeeeeeeeeeeeeeeeeeeeeeeeeeeeeeeeeeeeeeeeeeeeeeeeeeeeeeeeeeeeeee"
      ],
      "revoked_key_ids": [
        "key:sha256:eeeeeeeeeeeeeeeeeeeeeeeeeeeeeeeeeeeeeeeeeeeeeeeeeeeeeeeeeeeeeeee"
      ],
      "trust_domain_id": "trust-domain:example",
      "trusted_now_unix_s": 1788739200
    },
    "reached_stage": 6,
    "status": "verified"
  },
  "input_base64url": "eyJpbml0aWFsX2F1dGhvcml6YXRpb25fY29udGV4dCI6eyJlbnZlbG9wZV92ZXJzaW9uIjoidmFyaWF4aW9tLWVudmVsb3BlL3YxIiwia2luZCI6ImF1dGhvcml6YXRpb24tY29udGV4dCIsInBheWxvYWQiOnsiYXV0aG9yaXphdGlvbl9jb250ZXh0X3ZlcnNpb24iOiJhdXRob3JpemF0aW9uLWNvbnRleHQvdjEiLCJjYXBhYmlsaXR5X25hbWVzcGFjZSI6InZhcmlheGlvbS1jYXBhYmlsaXR5L3YxIiwiY29uc3RpdHV0aW9uX2FydGlmYWN0X2hhc2giOiIyMzhhOTM2MTUyNWY4Y2U0N2E0MjViOTNjNmE0OWZmNWZhNjZmOGJjMGE3MGM3YWVkMDI2N2YxMWE5MDQ0YzljIiwiY29uc3RpdHV0aW9uX2VudmVsb3BlX2RpZ2VzdCI6IjZiNzc5NjRiM2JhZmUyNGMyNmM1ZTk5ZDA5M2FiZGJkYTUxZGUzNjA1Nzg3Zjk0MjA0YWQ5ZTJjYjAyYzM1NTUiLCJrbm93bl9saW5lYWdlX2lkcyI6WyJnZW5vbWU6cGFyZW50Il0sImxpbmVhZ2VfY2FwYWJpbGl0aWVzIjp7Imdlbm9tZTpwYXJlbnQiOltdfSwibGluZWFnZV9pZCI6ImxpbmVhZ2U6ZXhhbXBsZSIsInRydXN0X2RvbWFpbl9pZCI6InRydXN0LWRvbWFpbjpleGFtcGxlIiwidmVyaWZpZWRfYXJ0aWZhY3RfaGFzaGVzIjpbImJiYmJiYmJiYmJiYmJiYmJiYmJiYmJiYmJiYmJiYmJiYmJiYmJiYmJiYmJiYmJiYmJiYmJiYmJiYmJiYmJiYmIiXX19LCJpbml0aWFsX2lkZW50aXR5X2NvbnRleHQiOnsiZW52ZWxvcGVfdmVyc2lvbiI6InZhcmlheGlvbS1lbnZlbG9wZS92MSIsImtpbmQiOiJpZGVudGl0eS1jb250ZXh0IiwicGF5bG9hZCI6eyJldmFsdWF0aW9uX3RpbWVfdW5peF9zIjoxNzg4NzM5MjAwLCJpZGVudGl0eV9jb250ZXh0X3ZlcnNpb24iOiJpZGVudGl0eS1jb250ZXh0L3YxIiwicHJldmlvdXNfc25hcHNob3RfZGlnZXN0IjpudWxsLCJwcmluY2lwYWxzIjpbeyJrZXlzIjpbeyJhbGdvcml0aG0iOiJFZDI1NTE5Iiwia2V5X2JpbmRpbmdfdmVyc2lvbiI6ImtleS1iaW5kaW5nL3YxIiwia2V5X2lkIjoia2V5OnNoYTI1Njo5MWUxZDU4NzQ3NDkyOGI1NjZjMTNlODU0NmM5NzdhYTEzOTI3YzQwYzM3MjE4NWQ1NjVkZGZmNTEyNTFkNjA5IiwicHVibGljX2tleV9iYXNlNjR1cmwiOiIxMXFZQVlLeENyZlZTXzdUeVdRSE9nN2hjdlBhcGlNbHJ3SWFhUGNIVVJvIn1dLCJwcmluY2lwYWxfaWQiOiJwcmluY2lwYWw6YnVpbGRlciIsInByaW5jaXBhbF92ZXJzaW9uIjoicHJpbmNpcGFsL3YxIiwicm9sZXMiOlsiY2FuZGlkYXRlLXByb3Bvc2VyIl19LHsia2V5cyI6W3siYWxnb3JpdGhtIjoiRWQyNTUxOSIsImtleV9iaW5kaW5nX3ZlcnNpb24iOiJrZXktYmluZGluZy92MSIsImtleV9pZCI6ImtleTpzaGEyNTY6ZjA3ZmQ2YzZjNGM4MzZlZGE1YmIwYTRlZTJkZjBjZmM0NTI0YWFkMDA0YmM4OWJiOWVlMmFlNDc1NzQ3NzIyZSIsInB1YmxpY19rZXlfYmFzZTY0dXJsIjoiUFVBWHctaERpVnFTdHdxblRSdC12SnlZTE04dXhKYU13TTFWOFNyMFpndyJ9XSwicHJpbmNpcGFsX2lkIjoicHJpbmNpcGFsOmlzc3VlciIsInByaW5jaXBhbF92ZXJzaW9uIjoicHJpbmNpcGFsL3YxIiwicm9sZXMiOlsiYXV0aG9yaXR5LWlzc3VlciJdfSx7ImtleXMiOlt7ImFsZ29yaXRobSI6IkVkMjU1MTkiLCJrZXlfYmluZGluZ192ZXJzaW9uIjoia2V5LWJpbmRpbmcvdjEiLCJrZXlfaWQiOiJrZXk6c2hhMjU2OjAwNWE1MmZlMmViNmY5MjEyYTg5YTZkYTUzOTlmODU0N2U0NTMyZDQ0MmEyMjEyMWY5ZDFhMzkyMjg2MjNmNWEiLCJwdWJsaWNfa2V5X2Jhc2U2NHVybCI6Il9GSE5qbUlZb2FPTnBIN1FBakR3V0FnVzdSTzZNd09zWGV1UkZVaVFnQ1UifV0sInByaW5jaXBhbF9pZCI6InByaW5jaXBhbDpzZWxlY3RvciIsInByaW5jaXBhbF92ZXJzaW9uIjoicHJpbmNpcGFsL3YxIiwicm9sZXMiOlsicHJvbW90aW9uLXNlbGVjdG9yIl19LHsia2V5cyI6W3siYWxnb3JpdGhtIjoiRWQyNTUxOSIsImtleV9iaW5kaW5nX3ZlcnNpb24iOiJrZXktYmluZGluZy92MSIsImtleV9pZCI6ImtleTpzaGEyNTY6NzQwZTQ2MGY0NDc4OGFhZTY1NjE5ZDlhYTgwN2M4Y2U3ZTUzNjcwMWU4NWQ0MjljNDIyNjc2MjY5OGVlYjkyZSIsInB1YmxpY19rZXlfYmFzZTY0dXJsIjoiSjRFWF9CUk1jalFQWjlEeU1XNkRoczdfdnlza0tNbkZILTk4V1g4ZFFtNCJ9XSwicHJpbmNpcGFsX2lkIjoicHJpbmNpcGFsOnZlcmlmaWVyIiwicHJpbmNpcGFsX3ZlcnNpb24iOiJwcmluY2lwYWwvdjEiLCJyb2xlcyI6WyJldmlkZW5jZS12ZXJpZmllciJdfV0sInJldm9rZWRfZ3JhbnRfaWRzIjpbImdyYW50OnNoYTI1NjplZWVlZWVlZWVlZWVlZWVlZWVlZWVlZWVlZWVlZWVlZWVlZWVlZWVlZWVlZWVlZWVlZWVlZWVlZWVlZWVlZWVlIl0sInJldm9rZWRfa2V5X2lkcyI6WyJrZXk6c2hhMjU2OmVlZWVlZWVlZWVlZWVlZWVlZWVlZWVlZWVlZWVlZWVlZWVlZWVlZWVlZWVlZWVlZWVlZWVlZWVlZWVlZWVlZWUiXSwic25hcHNob3Rfc2VxdWVuY2UiOjAsInRydXN0X2RvbWFpbl9pZCI6InRydXN0LWRvbWFpbjpleGFtcGxlIn19LCJ0cnVzdGVkX25vd191bml4X3MiOjE3ODg3MzkyMDB9",
  "input_sha256": "8abcc773f1697c54a51d9eaa6d9515a65cbb56ca952fb6f197d016f9d2149b4c",
  "notes": "Self-contained trusted-anchor genesis input.",
  "signature_vectors": [],
  "stage": 5
}
